,Comments,Emotion
2670,who has lands at amaravathi and whose cast is the majority over there we can clearly see naidus intention also in the past we lost two cities chennai and hyderabad this is the time we'll get to have equal development all along,Positive
2671,i don't understand one point here jagan mohan reddy is the cm of the state for decentralised development he can sanction multiple projects in whatever location he wants he can provide necessary support for the companies to invest in that specific location what is the need to go for 3 capitals when on an executive and legislative front he can develop the mentioned regions with multiple projects,Positive
2672,useless fellows think 3 capitals and finally the mafia gang turned it into a state without capital,Negative
2673,when party changes rules changes 3 capital can not be formed because people of amaravati will put case again so it better to stop 3 capital and focus on one capital for name and develop every district,Neutral
2674,it’s not our house to change will come new cm new capital like that it not fair it’s a right decision then delhi is for north indian capital south indian was suffering so set the indian also 3 capitals,Negative
2675,it's been almost 9years done when telugu states fibergation world is moving fast but still ap struggling to decide for capital location what a shame,Negative
2676,karnatak need 3 capital south bangalore center davangere and north hubli,Positive
2677,worst cm,Negative
2678,28 states :-only one thought why experiment without pilot let one state try (who's the scapegoat?) a p (screaming in excitement): me me me me yes telangana: laughing secretly,Negative
2679,fake news,Negative
2680,3 capitals are good in my opinion in this new generation world should do experiments as some says capital one and decentralization will not have the spirit what is the issue to naming capital it gives a moral power to people the same is missing in amaravati which lakhs of crore project and it is a clearly tdp's monopolistic plan,Positive
2681,jagan is the most corrupted man in india he has many ed &cbi cases still cases ongoing and for his self-benefit he pushing 3 capitals besides that he making land grabbing,Negative
2682,as jagan can't build a capital he brought this 3 capital idea just to confuse people,Negative
2683,because jagan mohan reddy doesn't know how to develop a single capital lack of knowledge he just playing games with 3 capitals !!!,Negative
2684,jagan reddy garu only destruction one no construction,Negative
2685,3 capital would be best as all districts will get some attention and interstate transport and commerce would florish odisha have 2 capital bhubaneswar executive and legislative cuttack judicial,Positive
2686,if you guys had visited amaravathi then you would've got more clarity,Positive
2687,decentralisation is correct even near near future all other states will follow this i support,Positive
2688,i watched this video bsc of ur tagline @thehindhu does ap need three capitals? and question remains the same as before for me so u @thehindhu just wasted my time,Negative
2689,u are totally wrong ap capital is hyderabad,Negative
2690,why both right and wrong what is the capital of jammu jammu and kashmir,Negative
2691,amaravathi is farce vizaq should be capital,Negative
2692,3 capitals is pure political agenda to attract 2 region peoples capital should be at middle of the state development should decentralized cheap tactics by current government,Negative
2693,amaravati is not suitable for capital without any basic needs or facilities like roads trains etc actually there are no farmers in that protest all are tdp supporters that's the reason why protest has been stopped according to high court there should be only farmers with id's with 600 people when police asked to show their id proof's it is hard to digest the fact to tdp supporters that less than 100 people exists to build the capital we need lakhs of crores with 20 to 30 years of time cities like hyd delhi kolkata bengaluru chennai all are under ruling of britishers with some facilities like courts roads and govt land and buildings which are not in amaravati,Negative
2694,inefficient cm no focus on development and just focused on freebies only he don’t have any efficacy to continue as cm,Negative
2695,it doesn't make logistical sense to have three capitals and move documents and officials around the three,Neutral
2696,if tdp has developed amaravati in their regime then why they have seen the worst defeat which no political party has seen in history of indian politics tdp could have combined vijayawada and guntur to make a capital instead of amaravati all the land owned in amaravati is owned by tdp sympathisers and it is not for common people tdp lost the trust of common people and also there is no younger generation strong leadership from that party to lead the state in future,Negative
2697,jai amaravati jai andhra pradesh,Positive
2698,mad man of ap mr thanosjagan,Negative
2699,vizag capital,Positive
2700,3 capitals only encourage sheep like this,Positive
2701,we dont need it they imposed on us,Negative
2702,amaravathi is hopeless capital with less amount developed vijayawada vishakhapattanam and kurnool,Negative
2703,"what ice capital of andhra pradesh? me: as soon as you know that, i will tell you first",Negative
2704,quit jagan save up save polwaran save amravathi save vizag steel,Negative
2705,very important point is : as an oppsition leader in 2014 and also as election promise in 2019 y s jagan mohan reddy support amaravati as one and only capital amaravati bill was passed unanimously and atleast single objection was raised more over almost 10 000 crores expenditure paid by government for the part of infrastructure the agreement with farmers also states the costs about 4 times of land market value was to be paid by government in case it fails or violates of master plan which was entered in agreement with farmers at the time of land pooling,Negative
2706,jagan is a failure cm he jus timepasing with 3 capital issue he created this issue for his power he can't afford to build a new capital were chandrababu can farmers gave there lands for free with any rupee only return of 0 2% land what they gave now returns after 20 years he is in power from 3 5 years but there is no 1% development even proper roads he is not able to do some ediots talking about cbn for only 1 hyderabad development did his time take some knowledge now in telangana is most 80% of revenue comes from hyderabad only but karimnagar adilabad people are not crying for only hyderabad developing they know that 80% revenue distribute the total state vizag is a green natural city it develiped by own you people hqve chance to build a new capital never happen in india before its andras luck to build there own city what the sense if already developed vizag need capital it will be a good it hubs if amaravathi built the revenue returns total state amaravathi has 30000 hecers of land now it can build with this lands only this sounds like commercial but this is 2022 all city's are build on there lands and revenue only stop crying bros love ur city and love ur state and stop racism for somebody or some community will devolop any development is its ur state only,Negative
2707,i think three capital is a financially most viable option for ap as whole and for the development of three regions the land taken from the amaravati farmers should be returned and keeping only a portion of those land for three capital model tdp is playing with the sentiments of poor farmers why should ap accumulate so much debt in its early days as a new state? that will affect whole development of the state be practical i am from kerala,Neutral
2708,jai amravati,Positive
2709,losing hyderabad was a great loss electing jagan mohan reddy as cm was another,Negative
2710,what is new in this? why this video now? however it missed 2 important facts one the amaravathi was selected with no opposition then and was supported even by the then opposition and there were no protests secondly the need for 1 lakh crores is not a fact the plan was only to provide necessary infra by the govt and to invite pvt investment anyway it is a lost cause,Negative
2711,we people of andhra pradesh are in a calamity called ysrcp,Positive
2712,ycp government achievements: 1) nava ratnalu(9 development schemes as per manifesto) 2) free housing and plots for poor 3) nadu nedu schools development 4) nadu nadu hospital development 5) rbk in every village for helping farmers 6) cheyutha for poor middle aged women( association with businesses to get regular income) 7) over 1 5 lakh volunteers to make all schemes door delivery for eligible candidates without corruption 8) dbt schmes (direct to bank - no middle man) 9) english medium government schools - in progress though several cases filed to stop it 10) arogya sri(over 3000 medical procedures free for poor people) 11) fee reimbursement for students free education 12) health clinics - family clinics facility - in progress 13) rtc overtaken by govt 14) several contract jobs made permanent ( rtc anganwadi grama secretariat and several others) 16)13 to 26 districts in ap makes development easy as area covered by collectors and other officers is less and easy to handle 17) several new ports and sez development 18) deesha police stations- female police officers - in progress 19) kadapa steel plant ramayapatnam port - no fake foundation stones like previous rulers 20) free electricity to farmers for agriculture by government 21) several solar power plants in anathapur kurnool and others 22)achieved 3 national corridors projects in the state - in progress 23) no 1 in ease of doing business skill development centers major local employment policy 24) afforestration plans - to increase forest cover from 23 to 33% 25)planning - municipal waste recycling 26) completed several water barrage and water grid in planning 27) won majority of local body elections no deposits to other parties 28) 3 capitals plan - decentralization - in progress (delayed due to cases filed) 29) amma vadi - 15000 paid for sending poor family kids to school to improve literacy rate in the state 30) major national bulk drug park setup at kakinada - in progress done several others completed/completing > 95% of the promised as per their election manifesto achieved many of these during tough covid times which cannot be ignored,Positive
2713,3 capitals ?? what ??,Negative
2714,andhra pradesh administration is very worsted no development no company factory etc andhra prasad students employ and going other but why because no development,Negative
2715,"after the demise of ysr andhrapradesh is bifurcated against the wish of the people of <a href=""http://a p now/"">a p now</a> the present government decision of three capitals is of no use development is at stake the state is left to the dogs only fighting for unnecessary things let the capital issue be resolved by supreme court's verdict and elections 2024",Negative
2716,we need 3 capitals former cm mr chandrababu naidu gave all lands to his caste people at amaravathi before making it as capital knowing that it is going to be capital and now the land rates are very high cbn cheated all ap peole he is a fraudster,Negative
2717,if this dude wants 3 capitals tell him there should be 3 cms with equal power aswell decentralisation of power,Negative
2718,moronic politician playing with people's lives he clearly don't want to build that cos it was the pet project of the old guy why do people elect these idiots!?,Negative
2719,tughlaq jagan = jaglak,Negative
2720,"how did they ""revive"" the 3 nonsense after court ordered them to build amaravathi!?",Negative
2721,"""decentralisation and inclusive"" translation: makings people's life miserable while keeping the establishment secure",Negative
2722,ap state is critical state where there is possibility to generate revenue to country and state if vizag is capital it's good for ap if we invest 2l to 10l crores one location poor will suffer one capital vizag other two region's as supporting capitals people sentiment is strong three capital congress has gone out from roots when went against people sentiment of ap same thing will happen to tdp,Negative
2723,cbn doing real estate for amaravathi land he is cheated farmers and doing their own business for own people that is the reason cbn defeat 2019 election in ap and especially in capital area also,Negative
2724,jagan is right andhra need 3 capitals,Negative
2725,so ap will become southafrica soon ?,Positive
2726,we have seen mental retartrd people in mental hospital but here it is different,Positive
2727,make every district headquarter a capital problem solved andhrapradesh will have 13 capitals so that decentralisation will be achieved,Negative
2728,we don't want to loose one more capital city like hyderabad so better do decentralisation and need *3 capitals*,Positive
2729,ap does not need 3 capitals if ycp does not know how develop the state without 3 capitals should dissolve the assembly and watch other people developing app with 1 capital,Negative
2730,capital less ap,Neutral
2731,andhra cm is a sadst by birth so he gets such wild ideas and he want to split people,Negative
2732,three capitals should be implemented,Positive
2733,it's just foolish act by this corrupt cm he just wanted to please all 3 regions ppl for votes he is just an corrupt politician who just want to work for ppl votes but not for development,Negative
2734,chandra babu naidu taken wrong decision it was blunder to collect farm land to construct international standards capital in farming land is not viable ap is deficit budget it is not possible and centralised development is not good for the state,Negative
2735,look at the history of ap guys 1953 came out from madaras without capital at that time chennai is a developed cityand it gone to tamilnadu and that time desided kurnool is capital for ap after that 1956 telangana and andhrapradesh merged and hyderabad become capital then in 2014 again ap devided telangana and andhrapradesh then again no capital to andhrapradesh 1 amaravathi is at kosta andhra if again kosta andhra movement started rayalseema loose everything that's why they are planning parallel development,Negative
2736,because ap have mr tugklak as c m,Negative
2737,fyi people who are protesting are not farmers those people are tdp paid artist if those people are real farmers why the protest is stopped in middle high court has given permission for 600 farmers (list was given by amaravathi jac) but where are those 600 members hence proved it's a fake prorest,Negative
2738,he is dangerous idiot,Negative
2739,3 region wants to 3 capitals no more madras & hyderabad only 25 villagers & real estate crocodiles want amaravati just one year before tdp lost vijayawada & guntur municipal elections amaravati situated above 2 cities 2024 ysrcp score big more then 160 out of 175,Negative
2740,amaravati is a cast based capital 86% of lands belongs to the cbn casts people for development of amaravati govt should spend lacks of crores while coming to vizag it's already well situated city where govt can able to invest less money to become ap capital in less possible time,Neutral
2741,south africa is a country and andhra pradesh is a small state in india we should not compare both there is no need of 3 capitals instead govt can decentralize the development like rayalaseema:- automobile and industrial development zone amaravati:- administration and i t visakhapatnam:- logistics medical and tourism development zone andhra pradesh has very good resources instead of spoiling them governments should utilize them in a wise way,Neutral
2742,"it is ysr "" cheap "" party and its present a p state govt ? not a p !",Negative
2743,andhra pradesh is not pursuing 3 capitals the present cm is pursuing it peoples were not at all interested but also opposing it,Negative
2744,capital can be only where administration would work from and where the cm sits and clearly that's vizag mere having high court in kurnool would not make kurnool a judicial capital however you can have names as legislative and judicial capital as there is nothing legally wrong in it and it's the prerogative of the government that being said vizag always deserved to be the capital right from the time the state got divided a lot of states in india have high court and legislative assembly in different cities the concept of decentralized development is a perfect idea and government needs to focus on attracting investments and building social infrastructure across the state and not just only develop vizag which is already developed,Neutral
2745,if these 3 capital statement by chandra babu everyone will say brilliant idea unfortunately this jagan,Negative
2746,don't keep heading andhra pradesh wants 3 capitals only ycp party leaders want 3 capital's,Negative
2747,the moment ys jagan bend infront of bjp politics i lost all respect to jagan he's incapable of getting special status to andhra,Negative
2748,playing 3 capitals game for not start even one capital (time pass 5 years ),Negative
2749,jagan can make properties at every captial he is unfit for cm candidate,Positive
2750,jagan is nothing but a fool there is no development happening in andhra,Negative
2751,ycp is worst government they can’t do anything that’s why they are bringing 3 capitals and doing time-pass fake cm fake government in ap,Negative
2752,our waste cm is just wasting time by bringing these bills and taking back again proposing the same bills he dont know how to build or development he only knows is changing names of the existing institutions and painting existing building with their party colors and demolishing some he is the best destructive cm we have ever seen,Negative
2753,he just giving money to people by free schemes but there is no industrial development or income generation just imposing taxes and increasing prices in all sectors he is not responsible for what is he doing by raising debt a true leader think about people's upcoming 3 genaration but he is just focusing on increasing in currupt money,Negative
2754,the answer is simple : to cheat and deceive the people of andhra pradesh one who doesn't know about ruling of mohd bin tuglak they can see such ruling alive here more over the interesting part is such ruling and such acts are supported by central government god save ap,Negative
2755,our thuglak didn't bring even one company rip for those people who believe thuglak reddy can develop 3 capitals,Negative
2756,worst cm i ever seen,Negative
2757,to stop another division only option is decentralisation to save public money also it's impossible to construct city in desert real estate mafia of cbn did this,Negative
2758,yellow media is more dangerous than today's andhra jyoti,Negative
2759,very corrupted politicians we have people are sick,Negative
2760,we support 3 capitals we can't trust cbn again and again,Negative
2761,amaravati is perfect place to build a capital city because amaravati is centre point of the state so it is easy and convenient to all districts in ap and also amaravati is become equal to metropolitan cities because amaravati is in middle of 2 big cities vijayawada & guntur 3 capitals decision is not correct because there is no enough money at state budget,Positive
2762,jagan mohan reddy worst cm in india,Negative
2763,jagan mohan reddy 420 cm,Positive
2764,amaravati is only the capital of andhra pradesh,Negative
2765,amaravati is perfect place to build a captain city,Positive
2766,jagan reddy is just playing a game this 5 years he is lotting next year again same story,Positive
2767,need capital in my village also so that my village also develop according to jagan gov logic,Positive
2768,"<a href=""http://www youtube com/results?search_query=%23apthanos"">#apthanos</a> knows how to destroy not to build",Negative
2769,amaravathi is development of one caste people and babu bhinamies 3capitals are development for all 3regions of andhrapradesh,Positive
2771,because ap’s don’t know the meaning of capital,Negative
2772,the idea behind this proposal isn't bad i e decentralisation and inclusive development of all however three capitals for a single state is too much i feel according to me it would be better if andhra builds 2 capitals-summer and winter capital like j&k himachal pradesh and uttarakhand,Positive
2773,few days later in ap and telangana each mla will want to form their own state corruption is at peaks in ap and telangana politician must be held in court and must be made accountable for every paisa they have spent on projects,Negative
2774,from the time jagan became cm there is no development in andhra pradesh roads are in bad condition and they are not working to fix that they are just giving money to all without doing any development,Negative
2775,i think ycp did not get any benefits from amaravathi than tdp so there is no use to develop capital,Neutral
2776,it's people fault first by giving such many seats to one party atleast next time they should behave wisely and by seeing recent news and events between the three regions in andhra we can soon expect andhra divided into three states and we are seeing slowly started telangana kind of movements here all credit goes to our current cm we did not expected this from this young cm finally if we have to see him again next time we need not to see the news/plan our future in andhra,Negative
2777,idiots financed development of hyderabad with both and andhra and telagana money and now we are left with no capital our tax money went into hyderabad and now when the state is divided we are left with no judicial executive nor legislative buildings just because all three wings were in hyderabad its better to not repeat that mistake,Negative
2778,i agree with 3 capitals for andhra pradesh because the development will be equal in all regions,Positive
2779,modern thuglaq jagan reddy,Positive
2780,"either amaravati is a foolish project or a selfish one i am against any govt doing such foolish projects the issue here is given 25- 50 years of time any established city in andhra will develop similar to (or infact much better than) amaravati this is because those cities need not be built from scratch amaravati takes more time than any other city in andhra this is a poor investment and only ""govt"" can take such poor decisions when a cheaper alternative is there why should the govt go for an expensive one chandigarh took 50 years to reach a population of 9lacs when you have one big city like vizag it is only logical and sensible to develop it to build on it instead of foolishly starting a new one from scratch any other established city will also serve as a capital for the next 100 years its not that only amaravati will be able do that govt should not involve in such things and they should never be allowed to have agreements such as crda its wrong and immoral the capital is built for the state and not for the 29 villages so the govt to promise the people in 29 villages a capital in exchange for land is ridiculous this agreement is in violation of public interest   if cbn really wanted to build a capital he would have constructed secratariat high court and other essentials in the govt land first and then he would have focused on real estate deals but he did the opposite and and govt should never be allowed to make such huge irresponsible deals with any section of society he was foucsed on lands first which lead to the failure of this project the fact that amaravati project is in such a state now is proof that any thing that govt touches is bound to fail   real estate developers will take land from us and say they will build an apartment and give us some flats in it how is the crda agreement different from it? its not never heard of any such agreement made by any govt the govt is not giving their personal money to do such type of agreements with any section of people in future any govt can do such type of deals with anybody and who's to stop it   naya raipur is a failure chandigarh took it almost 50 years to reach a popoulation of 9 lakhs the issue here is given 25- 50 years of time any established city in andhra will develop similar to (or infact much better than) amaravati this is because those cities need not be built from scratch amaravati takes more time than any other city in andhra this is a poor investment and only ""govt"" can take such poor decisions so not only this project is time taking but the returns on it also take a long time when compared to other cities like vizag or even vijayawada thus this project is a failed project all the lands in amaravati are under govt so one has to go through more beaurocracy to obtain land",Negative
2781,jagan reddy was worst cm never ever in indian history most corrupted political leader in entire world,Negative
2782,chandrababu naidu should have made vishakapatnam capital without any amaravati fuss in beginning itself,Positive
2783,nobody from visakhapatnam wants it to be the capital of the state only the ruling party wants to make it the capital already amaravati has been developed with capital in mind few lakhs of acres agriculture land had been procured now it will all be wasted centre should interfere in this matter,Negative
2784,that reddy cm cannot build even a bus stand not to worry,Negative
2785,people make fun of government but they don't see the attitude of amaravati people if by chance amaravati develops as a world class capital what guarantee do the rayalaseema people have that they won't be thrown out of city just like hyderabad,Positive
2786,he is brainless criminal destroyed worst cm in whole indian history,Negative
2787,because of bad politics,Negative
2788,420 cm things,Positive
