,Comments,Emotion
0,vidyadeevana pada is a moga padai keech,Negative
1,yet the vasathi deevena amount not released but vidhya bill is approved,Positive
2,thanks for vidya deewana,Positive
3,it is a waste of time and pressure on students if it is done beforehand,Negative
4,think ones,Positive
5,"there are many, it will be three months after raising grivmc, are you worried?",Neutral
6,,Neutral
7,kadara mundamopi removed withanthup inchans,Negative
8,ysr bima amount release date chepandi sir,Positive
10,the book,Positive
11,i was not given a house,Negative
12,babu,Positive
14,"after all, you are also doing the same thing",Positive
15,medals are given and then they are taken away after showing some reason.,Neutral
16,mother's lap did not come,Negative
18,third counselling pattade please please,Positive
20,not coming for us either,Negative
21,farmer bhorosa has not come yet,Negative
22,amount not credited,Negative
23,pm's first ry tube opening,Positive
24,rythu bharosa did not sing to us,Negative
25,best cm jagan anna,Positive
26,still not received,Negative
27,pm kisan pma istuntei jagan's name i am coming he says ntavah full support jagan,Negative
28,that skin is missing,Negative
29,pm kisan is not coming,Negative
30,nowhere about input subsidy,Negative
31,we don't have farmer insurance,Negative
33,ntavah ycp has become the sponsor,Positive
34,7500 amma dabba beat well,Positive
35,jai jagan sir please give me dsc,Positive
36,420 edava,Positive
37,for the sake of jagan,Positive
38,you are the king of deceit,Positive
39,420,Positive
40,sir what u did pls tell iam from bangalore i respect my friends in andhra,Positive
41,"during the cycle period, our house was a section, when you came, it was stolen.",Neutral
42,quit jagan mohan reddy save andhra pradesh,Negative
43,chatha paripalna naku marriage i e 4 6 month years inde ris card ladu ame chipalle naaku 2 childr en's badu ku 3 years baby 1 ears e sodhe everki chappu tharu edhe rowdy rajam dhenke support theka prajalu apudu marutharu naa name munna nadhe anantapur jilla peddavadugur mandalm venkatampalli my village problem clear chiasthbaa jagan anna,Negative
44,why what dramas,Positive
45,chudandi in badvel *there is one cp leader named pandi sriramulu.,Negative
46,supersir,Positive
47,it is clear from your two manifestos that people have become mustals,Negative
48,"we didn't know that if pora pooka asked one chance, one chance, one chance would be enough.",Neutral
49,"during the reign of chief minister vice jaganmohan reddy, i was allotted a house in nana palli mandal of kadapa district for 15 nara cents jai jagan jai vicesar cp jai vaisar",Positive
50,hey jagan seebum i can trust you but i can't trust you,Positive
51,the growth rate of debt is lower than before,Neutral
52,super anna,Positive
54,who went to jail and did chandrababu eat 18 water after robbing him?,Negative
55,tdp built the house but you didn't give it and still you cheated by not giving it,Neutral
56,increase 6000 for the disabled,Positive
57,jai jagan 2024 kam 175/175,Negative
58,east godavari dict low illapattu chikhar meru,Neutral
59,have you come to the village and checked?,Negative
60,did you give the house schemes? my brother died and it has been 3 years and the beam did not come,Negative
61,rip ycp,Negative
62,jai jagan super,Positive
63,sir employees ki cps ni 7 rojullo raddu chesi ops implement chestanu annaru kani mata tapparu kanisam before election anna ops implement chesi employees vote bank ni geluchukondi,Negative
64,"that poor man's time is running out, don't worry, no one will vote except the unknown widows who will vote for him.",Negative
65,drip subsidy release,Positive
66,new manifesto,Positive
67,antai is your nephew's brother,Positive
68,avunu anna kgbv inter colleges lo telugu subject bodi che adhyapakulanu thisivesi ladies ki anyayaam chesthunnaru anni demos interviews face chesi 4 5 years experience tho kgbvs lo join ayithe life baguntundhi ani chesthunna udyogaalu maanesi join ayithe thelugu subject ne thisivesaru ladies ki akkadiki vella lo am cheyalo ardam kaka adusthu naru,Negative
69,"anna said in rajahmundry that you can talk to r once in the kitchen, even if you told him what you said about yourself.",Negative
70,very very very 420 you,Neutral
71,"bocka cm, you are a brat",Positive
72,you are coming,Positive
73,"namaste, is what you said true, but this is a special status, if 25 mps win, you said you will bring them with your necks bent, now you go to delhi and bend your necks.",Negative
74,"sir, why is there no one who chooses each side of the kingdom?",Positive
75,"you also cheated, jagan, you are feeling that you have done a good thing",Negative
77,yours is ours,Positive
78,nv are big cheats,Negative
79,chetha cm jagan,Negative
80,"a telangana auto driver caught in front of vijayawada rto without paying border tb and even after paying tb within five minutes he wrote a case of 10,000 and told us that he will leave us if we pay 4000 rupees. rto took bribe from that driver, i am not rto, government, government employees, tell me, is the salary not paid properly?",Negative
81,jai jagan anna,Negative
82,supper anna,Positive
83,"tdco will give you a house, but how can you change the colors and make it feel like a cabin is built?",Positive
84,tdp gave loans in govt and there are no loans in your govt,Negative
85,"but why should tdco give you a house? it is not a house built by a cabin, but a house built with quality, even if you give the land for a penny.",Positive
86,"no matter how many such meetings you hold, you will definitely lose in the next elections",Positive
87,let down,Negative
88,"jai jagan, the next cm is also mere jagan, increase all the prices and kill people",Positive
89,donga reedy like musk,Positive
90,sachivalya job travaba mari a job release chesaru sir 4 year job leka nirdyagalu antha badha padaturu job cheylana antother state antother district veli pani cheyala vastundi manchi praivite company petana alochuna kuda miku ledu botton nakadam tapa,Negative
91,why didn't you pay 1000 for songs like you don't cheat why didn't they work your name,Negative
92,rip ysrcp,Negative
93,that means you are from hell,Negative
94,luccha gadu kendram icche improvement nidulu kuda pathakalaku petti daniki thuglak perlu pettukoni janalanu gorrelu chestunte adhi paytm kukkalu muruguthunnayi 1st development and improvement ante thelisinte manolla adukkonevallu kadu velli pakka rashtralku ap rates compare cheyyandi nenu ycheep support chesinonne kani appudu tappu chesamu malla cheyyakandi ap ippudu 19th place lo undi arthikanga chala venakabadi unnamu dabbuki asha pokandi repu bavishyattu alochinchandi,Negative
95,nikon's trick is leru,Negative
96,jokes,Negative
97,why because you will be gone,Negative
98,"you married and gave away, nayana",Negative
99,where is the capital?,Negative
100,who made him cm erri pooka for me eachidu house in 2 cents you are a big thief to my mother you were born wrong.,Negative
101,visakhapatnam has to happen,Negative
102,"because of chandrababu, telangana state was formed and andhra pradesh state was destroyed. all the property of andhra pradesh state is alanjakodu (chandrababu) in telangana. if tdp wins again, everything will go to rayalaseema.",Negative
103,please vote yapudu with anna,Negative
104,ok,Positive
107,goddline codekatheine nanmntham,Negative
108,"don't shut up, scams are scams",Negative
109,"orei picche jagan, you are the one who gives the government places, tell me what you have done, don't bribe us.",Negative
110,donkey smiling gulab jamun,Negative
111,"if you don't say something like that, it would be a little better, please",Positive
112,jai tdp party next cm of chandrababu naidu,Positive
113,the capital is mendira gudiseti lanza kodaka,Positive
114,good bye jagan bye bye jagan,Positive
115,tdp means no rainfall in the state all farmers will starve,Negative
116,"what is the administration of amaravati farmers who cut their throats and distribute free railways to the poor? reminding that the farmers had to bear the losses due to the loss of the farmers and more importantly, the development of this state was destroyed and the unemployed had to suffer the losses due to lack of employment opportunities.",Negative
117,they say that they should not believe you alone,Negative
118,hee sir,Positive
119,you gave bochoo inti patta 2year's back 10000rs i paid no direction till now 420,Negative
120,and what did you do? you took away the rice canteen where the elders eat rice and beat the stomachs of the poor,Positive
121,anna nuvve asthau anna 24 nuvve cm ma 15 otlu ne ke jai jagananna,Negative
123,bocca m is not payment batch mothome comments,Negative
124,"jagan ji, don't be fooled that our women are the leaders of the world class and volunteers are the reason for our defeat.",Positive
126,"first, don't scold yourself, but let people know what you want",Positive
127,saray ayana mosam chaysaru meru am chaysaru manchi chaysara mundu meru ydo manifesto release chaysaru kada danlo special status testa annaru nps tesaystam annaru yakkada avi matalu chpatam kaadu chaysi chupi,Negative
128,mana rajadani yedi jagan,Negative
129,"we remember the lies you told, leech",Positive
130,couple,Positive
131,"sir, there is no fraud like you in mega disk investment in history",Positive
132,"if i believe in you this time, i have to get rid of my stupidity, babu, why?",Negative
134,jai jegan aap legend kam,Positive
135,"jai jegam said that the man who has a face does not listen to the words of the cabin, he knows the sock fox",Negative
136,"there are no cc roads in the villages, there is no fresh water, people of alluri sitarama rajupaderu district are facing a lot of trouble, cm.",Negative
137,"vundhosukani jagan, who is in jai, cannot be in the government, he is a big fraud",Negative
138,what did you do?,Positive
139,you said correctly about jagan babu,Positive
140,"if a volunteer came to my wife, she did not come",Negative
141,you give to everyone,Positive
142,meeru evvaledhuga sir house,Positive
143,ma jaganana's ma votu meke,Positive
144,you are a big thief,Negative
145,there is no tdp party in up,Neutral
146,super jijgn,Positive
147,i can trust ravana but i don't trust you jaganmohan reddy,Neutral
148,"alu, no eyes, no eyes, did you not give the son's name as somalingam?",Negative
149,how did you get all the properties jagan? why do poor people stay poor??,Negative
151,ji jagan,Negative
152,good dialogue sir,Positive
153,"think about the capital of amaravati, you will come again and those who are scolding you will cheer you up",Positive
154,the cabin can't be done for years.,Neutral
155,"it is true that you have released the manifesto as you said, 40 years of experience has made it necessary to learn from you, unfortunately chandrababu",Positive
156,nuvvu cheater ra,Negative
157,"how many houses have you built, you bastard",Positive
159,my vote for ycp jagan fixed,Negative
160,next cm jagan sir2024,Positive
161,"due to your ardam bardam knowledge, the party leaders have left the workers in the air and this time there are chances that you will be sent home.",Negative
162,super cm,Positive
163,you have to come again and again jagan anna,Positive
164,420 tdp,Positive
165,jai jai jagan,Neutral
167,"brother naku house patta vachindi but house <a href=""http://kattukokoledu money/"">kattukokoledu money</a> problem but ipudu house govt kattistundi anrunaru 18000 to idi nijama",Negative
168,"babu should come, the poor should go to other states, this is the slogan",Negative
170,420 babu mosagadu,Positive
171,jai jagan's brother,Positive
172,stop it sir,Negative
173,ysr fake government,Negative
174,jalaganna no one will believe me,Negative
175,babu ne sode apu ne sode a dannam ra to you ne centu,Negative
176,what have you done raw waste cm in up spl status no take money and press the button from the central and you swallow the rest of the money,Negative
178,jai jagan jai yasar,Positive
179,anna mundhe jewed woi anna i anyanam chhaiku anna certificates klug undaye ana mosapu jaganna,Negative
180,jai telugu country,Positive
181,big 420 cbn,Positive
182,"before the disk notification, we will lose without any sweeties",Negative
183,"unfortunately, your father is good",Positive
184,bye bye gagan close,Positive
186,"if someone came and destroyed the state, if you think alternate better, then he will also go in the same suit, no one can see this state anymore.",Negative
187,"if the manifesto of welfare schemes is made, tdp will be grounded",Positive
188,good bye jagan anna,Positive
189,ysr,Positive
190,do you have shakhishi paper?,Negative
191,you did not cheat sir,Positive
192,you are a yard thief,Negative
193,chameleon has changed colors vennupotu babu false promises al free babu jai jagan jai essar jai ysrcp,Negative
194,jai jagan sir,Positive
195,bye bye jagan,Positive
196,appara pooka erri pookula sollu you say,Negative
197,"if you were not up then, you gave lands and gave loans to scs",Negative
198,andharu kottukondi evaru vachina ee rastraniki origedi em ledhu atleast aayana votes konukkodanki dabbulu vesi divala teyaledhu 10 years venakki vellindi state nee valla millalni elagayya nammedi employees ki salary iche paristiti kuda ledhu ekkada appu chesi votes konukkodame pani,Negative
200,ekanga elle kattadu nee swartam kosam vatini allott cheyaledu last ten months lo smasnam lo okka cent iste neeru drainege rodlu vudyoga sauaryalu yekkada drama lu apanna neekidi katti drama babai hatya nee patra meenanna kalamlo dochukunna fifty thousand crores yemaindi nee palace darilo pedala illlu kottesave dr sudakar lanti varini pitcollani chesave anantababu savanna door delivery iste yemchesavayya edi nee palana musali puli kata neeku saripotundi,Negative
201,"you shouldn't trust a cheater, jalaganna",Negative
202,"shame on you, you have shamelessly talked about people from all walks of life",Negative
203,you are ours alone,Positive
204,jai tdp,Positive
205,"if you are the cm this time, you will be fine",Positive
206,infatuated by apara,Negative
207,we don't want the government,Negative
208,special status? answer this one question or what happened to alcohol prohibition?,Negative
209,don't believe babu,Negative
210,this thief tv is a support for such theft,Positive
211,why did you increase the current bill of petrol diesel rates?? are you eating 2 per stomach?,Negative
212,we are asking sakshi if your mother is mogudi,Negative
213,jagan said that the old hosing bill was not passed,Negative
214,kamma paleru brokers should get rid of their poverty,Positive
215,chandra babu may copy the nava ratnalu and put in his manifesto with improved/modified version he will declare 1 5 cents in urban areas and 2 cents in rural areas to the poor and bpl people,Negative
216,jay saban,Positive
217,the pictures that do not look good must go,Positive
218,apara babu pour your blood,Positive
219,ys jagan mohan reddy is the beacon of hope for the poor people,Positive
220,"ntr is a victim of chandrababu's conspiracy, ramoji rao radhakrishna cooperates with brn",Positive
221,chandrababu skills development scam jd laxminarayan roll lokesh optical fiber grid scam esi scam purchase of telephone tampering tools case ed probe ongoing,Negative
222,chandrababu sivaramakrishna commission report threw it in the dustbin,Negative
223,5od evil eye garu see,Positive
224,looting and sharing is not enslavement,Negative
225,jai jagan,Positive
226,sanction house loans,Positive
227,mani fastu lu vastutin potuntai but people's cure chaisai mani fastu lu one & only vyssarcp navaratnam,Positive
228,anna clear the problem of five villages anna this problem in vizag anna anna you are the cm anna who worked on your call in covid,Positive
229,jai jagan jai sharmila jai ​​yasser,Positive
230,manifesto tdp 2024 every kamma gets 5 acres from his own constituency and every kamma student gets 5000 monthly,Negative
231,super jagan garu,Positive
232,"naam ki vash just their chasht girls who are the victims of rape, what can they do?",Negative
233,self container,Positive
234,dalit woman!!!!,Negative
235,"""shobhanagi reddy"" would have been home minister or deputy chief minister if she had been there. i am saying as a telangana person that the loss without her is irreplaceable. her service to ysrcp is priceless.",Negative
236,dalit word is illegal,Negative
237,jay mading,Negative
238,great idea cm garu,Positive
239,jai jagan mohan reddy anna super anna,Positive
240,he is against dalits as some of our us have govt jobs pensioners(but still no land no big house like ocs and bcs) he is cancelling everything but for ocs and bcs those who have 5-10 acres land 1000 to 1500sqft houses 200 to 500 grms of gold they are not considered as rich and are given rice cards arogya sri cards etc caste is not taken into consideration now what is this?god will surely punish all those who stand against poor native indians ie dalits,Negative
241,all actions those dalit leaders will not dare to speak against his decisions against dalits will be given power which is of no use,Negative
242,roja would have been a good minister,Positive
243,everyone says that roja is a senior and good talent than roja who also worked with vissar before her in sucharitha party.,Positive
244,some women are harassed by their aunts,Positive
245,roja made the mistake of getting the post,Negative
246,jagan has cheated the roja raks in the name of society.,Negative
247,"if we give seats like this to people we don't know, what will happen to roja who is known to everyone",Positive
248,why no proper post or respect akepati amarnatha reddy ?,Negative
249,brahmam gari kala gnanam lo cheppinattu anni keventunnai amaravathi capital kavochhu rajanna rajyam vasthundi mala madigalu mantrulavutaru bajagovinda govinda ani he told in his kala gnanam but this change should really bring excellence enno years ga sc st bc vallani lower profiles ani consider chesi society treating so bad though we got independence things in india not changed cm jagan garu ysr dad kante excellent decisions tesukuni ila start cheyatam we all r so happy for this keep going,Positive
250,jagan em chesado telidu em chestado telidu kani sc st ki kalpinchina political hoodanu next years marchipolemu thank you sir mee guts prajanayakudu ysr ni gurtuku testu kanneerupetistundi ayana athma ku shanti labinchi untadi eppudu,Negative
251,good decision sir keep going god bless you,Positive
252,is it christian? they did justice to the christian older sisters and the christian younger brothers.,Positive
253,it is bad that roja was not given home minister,Negative
254,we want roja & rk garu otherwise this is good decision,Positive
255,"did you cheat on roja's sister, down down cm?",Negative
256,where is roja & rk garu srkanth reddy ambati why not give ministry i am very disappointed,Negative
257,roja was wronged by stopping boxes on own tv,Negative
258,madda vesaadu roja aminddi ame kantte veellu em peekaru antha sc st bc avadamena veela qualification thu jagan gadu kuda andarilage waste politician inka vadiki vote vesedi ledu,Negative
259,roja hard work for your party and cm chair,Positive
260,bloody jagan what a hell is this roja wants to get home minister post some bitch lady is getting home minister post u will definitely pay off this jegan,Negative
261,roja ki minister post evali sir plus,Positive
262,roja garu ekada,Negative
263,where is roja,Negative
264,the real hero is our anna jagan,Positive
265,"as much as they cursed jagan, tdp also cursed roja even more than that, what is the benefit of avanti srinivas instead of giving her the sin.",Negative
266,he said that no one should feel bad that roja is not there and he will give the post of chairman of rtc,Negative
267,you are the son who surpasses the father,Positive
268,"it was very difficult to give it to roja, but it would have been better if it was given by the deputy cm",Positive
269,super chase anna,Positive
270,mekathoti sucharitha is a christian ofcourse hindu on paper to get sc certificate,Negative
271,roja garu is not a wrong step,Positive
272,gd,Positive
273,tell me on your dabba tv why injustice happened to elder sister roja,Negative
274,it would have been nice if rosa had done a lot for the party,Positive
275,super jagan sir u will be cm till 2044,Positive
276,good congrats cm jagan sir,Positive
277,hee sass super madam die,Positive
278,avunamma! you are 100 % talked perfectly anna garu mahilaa samaajaanni theeeerchi dhidhaaaaru but you too have a response ie jaganannanu sakramanga theeerchi dheeedhaaandi ladies played an importent role in collapsing great kingdoms every scheme on ladies implementing to collect votes of ap ladies,Positive
279,main switch bagga che pairon that is women j y s r,Positive
281,yes god bless ysr family amen,Positive
282,jagan,Neutral
283,sharmila reddy's sister was forgotten why if jagan is in jail ysp saved you sharmilamma why did they forget her,Negative
284,jai to ys vijayamma,Positive
285,amma talle ma kalley adhrmam talooka low eelante entate subhasheta upanneyasam evvaru ea magadi kane ea stree kane speech evvaledamma ede deaseyaneke garvakranamamma neeku naa seta kowtenamskara sunane vandanalu etlu meeveo kka srewobhe lashe mareu y s r kutumda sabbwedene bharat vase bhagavan dase fees reedeng maostar mahaboobpeeran gangavoram,Neutral
286,is there only one english speaking minister in the tdp government? all the ministers in this government are well educated,Positive
287,super madam,Positive
288,"oops! roja panchule panchule in plenary <a href=""https://www youtube com/watch?v=st4nbqo66yu"">https://www youtube com/watch?v=st4nbqo66yu</a>",Negative
289,super speech sister,Positive
290,super speech mem,Positive
291,who ne,Negative
292,johar yasser jai jagan anna jai ​​yasser cup next come pakka 2024,Positive
293,vote for jana sena,Positive
295,what did cha nee babu do? rayalaseema got water because of the cabin,Negative
297,veediki mind dobbesindi roi !!! chesindantha marchi poi mahanubhavudu ipoyyadu ! kalavulu thovvakundane commissions dobbina putra ratnam polavaram lo kummesina commissions dobbakunda chesi vunte 12years back polavaram ipoyyedi 6 months polavaram continue chesi vunte next year neellu vacchevi !! nee moham manda,Negative
298,sir tell us a little about sangamitra salary sir,Positive
299,this is not be good to change like that if u want build new and name that one,Negative
300,they want a lot of money to name babu's uncle,Neutral
301,who asked to change to ntr ? we shouldn’t keep individual names modi itself keeping pm yojana etc,Negative
302,hmmm good decision,Positive
303,"jagan said that if the hospital bill exceeds 1000 rupees, he will pay it to arogya sri, if it is implemented soon, everyone will get medical treatment in ysr's name. jai jagan",Negative
304,say new things,Positive
305,"why is it necessary to change the names, whoever started it should belong to them, but what is the reason for the development?",Neutral
306,call me cm jagan don't call jagan remember is the chief minister of andhra pradesh,Negative
307,ap ki perfect cm ga jagan anna we will with you jagan anna,Positive
308,"name changes are not important, people should get better treatment",Neutral
309,"what is new in changing the name, this party will favor those who came",Positive
310,god bless you cm sir,Positive
311,name is not at all we want treatment sir,Negative
312,"sir griha nirman pathakam house loans jagan's issue, media has accused mani chapande sir.",Negative
313,lakshmi parvati's stomach is flat,Neutral
314,"the name is not important, we know that it was s who gave the name, but the one who gave the name will be remembered, but what matters is how well the service was given.",Positive
315,ntr all telugu people are not right to insult such a person how to insult those who have given recognition to telugu people is a proof of your perverse politics,Negative
316,all money is wasted to change names,Negative
317,waste politics,Negative
318,jai tantra,Positive
319,jayaho jagananna,Positive
320,make it applicable to all diseases by any name cm sir,Positive
321,"if babu wins, father's name is jagan, father's name is sonia, if husband's name is rajiv, is there anything new to do to change names?",Positive
322,super,Positive
323,our god is elder!!,Positive
324,arogya shri atta gurtun kochedi ne and onliyyayyay yasar,Negative
325,"haseena, are you well? have you eaten?",Positive
326,sir pl look into narsipatnam,Negative
327,hi sir please first constraint on helping people and development and stop on going crime and clear all pending cases in court i think it's better by changing name what problem will solve please can i know,Positive
328,anna read,Positive
329,what is sensational in this is that it is common for whoever is in power to do what they want,Positive
330,if chandrababu comes ytr jagan and ysr then there are no more good people in the state.,Negative
331,we will get all types of medical treatment s at district level hospital s 108services also having in good condition emergency medical treatment saves so many lives pranamamulu to rajanna for arogyasri,Positive
332,keep doing jagan anna god is with u no turning back,Negative
333,changing the names is enough for the cm,Positive
334,arogyasri is very good welfare scheme so many lower and middle class people are surviving for employers pensioners also having medica l assistance with out any delay we are no need of medical re imbersement getting medical bills claiming through treasuries difficult to us so there are some changes getting medical treatment amont kindly look at it,Positive
