,Comments,Emotion
819,"hello bbc if you want to take a loan from the central govt, ap govt agrees to increase the electricity bills. due to taking a loan, the cost of paying off the debt will increase. once this happened also during chandrababu naidu's time (according to the conditions of the world bank). because state is not development. central and state govt are charging more charges for goods that generate more income, but if charges are low for anything, the cost of all kinds of goods will be at affordable prices. jai bharat, the looted wealth will remain in the hands of a few people. population is economic resources for some people",Negative
820,eyes thriipincharu,Negative
821,good clarify,Positive
822,"this bill is free power for the builder, this bill is ladhu for sc st people",Positive
823,this is too much bro bbc is best awerness youtube,Negative
824,super explain saru,Positive
825,the free money given is withdrawn in the form of current bills,Negative
826,ap gorrelara experience your sin in 2019 is not small,Negative
827,"build for adani for the nation, come blind devotees",Positive
828,yerabba paytms gaallu naanyamaina current ani okadu ac lu vaadithe raava ani okadu padhakala kosam ani okadu mana tadepalli paytm gaaraithe abbo inka cheppakarle current bills money tho pedhavallaki money vestham ank cover chestadu,Negative
829,good explanation,Positive
830,tigers and lions are very hungry and these are common under their rule,Positive
831,"every time the electricity bill comes, i feel like cursing the fan",Negative
832,"if you vote for chasht, it will be like this. chasht people are good in andhra pradesh, but our telangana is better.",Positive
833,middle class means below adani rich class means above ambani,Positive
834,why transo companies are buying imported coal for higher price? is it better quality than the domestic coal?,Neutral
835,sir vela ki velu pay chestunappudu true up foc chages mha iytea hindered loo untunae adi kaadu samashya power bill pergadaniki main reason units alaa yakkuva yanduku perugutunne same home appliances unnappudu units every month ki yanduku perugutunaae edi meter maaku fix chesi remote akkada undi kaabatti units elaa set chestunaaru emo doubt gaa undi,Negative
836,people will ground tdp if bbc etv tie up stories are explained correctly.,Positive
837,"if the people are not willing, who will give from the job?",Neutral
838,"if we don't bring down this incompetent, we will all perish",Negative
839,a common man has to bear such things as the rate per vote increases,Positive
840,by giving 200 units free,Positive
841,"who is bokkali like that, my aunty, i can tie it, those who can't tie it, those who voted for uncle jagan, put the stick back",Negative
843,naaku ee rajakeeyala tho sambandam ledu nenu hyderabad lo unta naa vote kooda manikonda lone undi naaku prathi month 1000 - 1200 vasthadi ee month 3000 vachindi kakapothe theliyaka nenu prathi roju 18 hours ac use chesa kabatti vachindi anukunna mee lanti medhavulu cheppaka ardham aindi kcr jagan valla 3000 vachindi ani down down jagan & kcr jai cbn,Negative
844,indulge in the power of dammunnodu app that reviews pappa,Positive
845,battai seems to burn very well,Positive
846,always the best info,Positive
847,ys jagan mohan reddy bellam tax,Positive
848,what is built by the people is what is lost by the people,Positive
849,this modi government is forcing people to buy coal at a higher rate and make them more profit.,Negative
850,big stone in pichodi's hands,Positive
851,"any politician can open up all the debts with all the assets. when jagan votes, we should think about it.",Negative
852,77 thousand to btec students 500 curent bill gola endira bbc in 2024 bbc will ban you this is british tv,Negative
853,do not misunderstand pawan current to mean wind current,Positive
854,"due to lack of unity in all the other parties of the original congress, an evil force called bjp has arisen and it is doing such evil rule by placing its child evil forces in some states, so if the big evil force is buried in the upcoming elections, the rest of the child demons will be destroyed automatically.",Neutral
855,what is electricity pawan electricity sun rays electricity hydro electricity what happened to all these hydro electricity solar power plant rehabilitation is our responsibility,Positive
856,why modi allowed adani to sell that much high cost coal from australia it's clear scam from modi adani rss looting indians money crazy modi,Negative
857,"buying coal from adani at a high cost is to satisfy modi, in which central and state governments are two thieves.",Positive
858,main stream media wouldn't expose it because most of them are big scammers getting money from politicians,Neutral
859,"""badude",Negative
860,kick it,Negative
861,"if our kamma people come, he will reduce it.",Positive
862,"even in karnataka, 4 times perigai offi should also be shown",Positive
863,evil governments for greedy people,Negative
864,chetaka ka pote resigned and died at home and destroyed the state of andhra and why did they increase the price of liquor dog,Negative
865,good analysis thanks to bbc,Positive
866,should remove vote right to who ever not filing taxes and taking freebies,Negative
867,karma ra babu,Positive
868,great topic to discuss literally no one can solve jai bjp jai congress jai ycp jai tadap jai janasena jai ​​hind!!,Positive
869,"elections are ahead, but now if money is also available, it will come in handy for the expenses",Positive
870,6 5 what is the point of canceling renewable electricity and buying thermal (coal electricity) at rs 20? idhe cabolu is the best example of reverse palana tughlaq rule,Negative
871,"whichever government has come, they are now telling us which chargers are wrong in the cabin time.",Negative
872,democracy is gone and now everything is the kingdom of kings and they rule for themselves,Positive
873,that's why the people of ap should change the government,Negative
874,"debate on a larger scale? except your channel and tv5 maha abeen, we have not seen such a huge discussion in other channels",Positive
875,"everyone needs electricity, they don't know how electricity is generated, many electrical companies are bankrupt due to debt. banks finally write off the debt of lakhs of crores of rupees and take that debt in some form from the public.",Negative
876,is it appropriate to train andhra before the free electricity stop?,Positive
877,"if you read the comment box, yitchap govt will commit suicide",Negative
878,caused britain to go bankrupt,Negative
879,"ray, all these things are also in our telangana, we are getting the same bills, but here the media has become a pawn in the hands of kcr.",Positive
880,"for that, buying 19000 boxes of coal which can be found at 8000, it is our blood, have you ever seen a prime minister who loots more",Positive
882,"shameless people of andhra pradesh, my condolences to you people of andhra pradesh.",Negative
883,even in telangana electricity bill almost doubled,Negative
884,electricity charges tho saripodhu appulu chesi biryani panchadu ga daniki next 5 years lo get ready to pay more more house tax road tax registration tax building tax etc etc etc ap prajalaku panduge panduga jai ​​tuglak,Negative
885,ycp govt is a rift among the middle class people,Neutral
886,jalaga is the reason he is sucking people's blood,Negative
887,feel the heart beating well,Positive
888,reason is jagan who is a money sucker,Negative
890,smart meter ani chepi current metersni manipulate chesthundhi government government control thone meters panichesthunaiye thappa current akalunnadanni batti kadhu,Negative
891,jai jalaganna,Neutral
892,very worst bill's,Negative
893,"did you vote for the fan? if the fan turns on in the house, the money will not be paid",Negative
894,not only in up but also in karnataka,Positive
895,"he can rule, but if he is given office, if this tughlaq comes again, he will pay 10 rupees per unit.",Positive
896,"it is the same in all the states, what should we do, those who post comments here, can you see other states?",Negative
897,above is modi's government for gautam adani and below jagan anna's government is rallying people for him.,Positive
898,sir file a pill in the court for public interest,Positive
899,it is known that we will lose anyway,Positive
901,they said that electricity is free up to 200 units! these poor people have no use for such people! lucky ones,Negative
902,waste candidates ruling lo unte inthe mari lakhs of crores of debts and development zero employment ante 5k volunteer jobs anthe abbo chanthadantha undhi veella dharidrapu management,Negative
903,is there such a thing in the electricity bill? where is the justice?,Negative
904,no eating charge bathing charge i'm happy,Positive
905,mad tughlaq who ruled without a capital cm,Negative
907,telangana has also increased the electricity bill,Positive
908,this is a crooked government,Negative
909,the person who looted lakhs of crores and went to jail was given the power. he who is addicted to looting is like a lion who tastes blood and will die even if he dies but his looting mind will not change.,Positive
910,"poyam cheated, gone cheated",Negative
911,the fan's bills are a huge waste of money,Negative
913,jagan please stop free schemes except old age pension and development the state,Negative
914,this is called tughlaq rule,Negative
915,this is what happens when a corrupt person leaves the development to the winds and enthrone someone who thinks it is enough to fill his pocket.,Negative
916,can the electricity bill be increased on the unit? is it because of using more hours? how much less can tdp telugu bbc get,Neutral
917,every mistake should be made to bear the consequences,Positive
919,"jagan reddy who is giving chocolates and giving necklaces, last month our electricity bill was 224 /- this month 404 /- does not make sense.",Negative
920,another good one for us@ap people thanks to bbc telugu,Positive
921,all the people of andhra went and said jagan,Positive
922,"if they give 1500 2000 votes, we will say that, when will their time be democracy?",Negative
923,they are so bubbly,Neutral
924,governments paisa vasool system from people's,Positive
925,tughlaq's rule must bear the ups and downs badudu,Positive
926,'badude badudu' is now known as jagan,Positive
927,"all people have understood that your channel is green, instead of background red put it in yellow.",Negative
928,"they gave a stone to a madman, but he didn't know who it would hit",Neutral
929,enjoy badea badu voted,Positive
932,badu badu psycho badudu,Negative
933,govt jobs reservation for farmers children only for small scale farmers,Positive
934,totally fraud govt,Negative
935,chandrababu naidu is poised for a landslide victory,Positive
936,"until then, they are giving it to the farmer's account, they are giving it to the poets.",Neutral
937,"jagan mohan reddy gave input subsidy to how many people, if there were 1600 1600 farmers in our village, which 60 people would have lost?",Negative
940,rythu bharosa chachi mosam guru,Positive
941,9500 came,Positive
943,shouldn't we think about the time when so many schemes like this are being given in the state during the difficult time of corona?,Positive
944,sir jagan siriki hatesof who is doing good for the farmers by adhering to his word that the spread of corona has completely reduced,Negative
945,2 thousand rupees for 1 acre we don't even get insecticide we don't want any money but give us support rate for the crop grown sir,Negative
946,"actually, you said that you will give 12500/- to the farmers at one time.",Negative
947,this cm is doing completely injustice to farmers,Negative
948,what swami you are giving only 7500/- (modi ice giving 6000/-) but you are giving a buildup that you are giving the total amount of 13500/-,Positive
949,great cm and great jagan,Positive
950,it's very useful to farmers,Positive
951,our kcr does not like us,Neutral
953,sir you are great and efficient c m jaganmohan reddy sir,Positive
954,"the farmer is not the king, but the situation is not the same today",Positive
955,10 000 per acre investment assistance would be good as input subsidy has not been given so far,Positive
956,"my friend is not a farmer, but he is a farmer from barosa.",Positive
957,jagan is very apt for ap people give freebies and they will not care about anything else,Positive
958,thank-you so much sir,Positive
959,mr cm with deficit budget 1st try to meet the state immediate requirement s 2nd state development 3rd free distribution,Negative
960,god bless you jaganna,Positive
961,nee bonda brosa matalavarakera neeprabhutvam,Negative
962,it would be good if the fourth and fifth installments of farmers' loan waivers are also paid,Positive
963,you have really helped us in corona time jai vissar,Positive
964,what a credibility all schemes time to time through bank account hats of cm sir,Positive
965,"if the kangaroo poets leave the farmers, their lives will be changed",Positive
966,"swami, if you think it will happen",Negative
967,janalanu lazy cheyyakandi sir social schemes like ration money help e government ruling lo unna istayi ptajalaku dabbulu panchutey otlu vastayi mana pani ayipoyindhi long vision leni governments ryrhulaku seeds quality vi ivvandi bank loans proper ga vachela chudandi gittubatu dhara vachela try cheyyandi antey gani money ichi ptajalaku lazy laga tayaru cheyyakandi sir,Negative
968,no farmer assurance no pichuka al ar debits,Negative
969,"it's been a year since the dds were tied to the farmers for the drip equipment, so far the material has not been supplied to them. the farmers are thinking that it is too much.",Neutral
970,fraud,Negative
971,best cm,Positive
972,farmers should be subsidized as they have nothing to harvest farmers have no interest so far farmers' assurance should be applied up to five acres,Negative
973,super sir,Positive
975,how much will it cost?,Positive
976,"during the padayatra, i have given you some kind of schemes while walking hand in hand with you. he gave me that letter. i am asking for a three-wheeled motor cart for my friend.",Positive
977,"if all the debts are shifted from this state, i will be sidelined in the future",Neutral
978,let's wake up zohar isr,Positive
979,sup cm jagan anna,Negative
980,"farmers are not happy, sir, what the farmer needs is insurance. those who took crop loan in the bank did not get interest subsidy.",Negative
981,to the former like god sir,Positive
982,good decision,Positive
983,the center is also supported by chupeddi kim,Positive
984,jai jagana,Positive
985,pawan kalyan's discussion on this topic has now become a highlight,Positive
987,good job jagananna but volunteers are not need,Positive
988,tdp govt vaste ministry lu teseyali,Positive
989,super andi babu,Positive
990,nuvu ante money ivvaleka jobs ivvankunda new concepts pettakunda malli jagan sir ni antunnavu nuvu em chesavu em new pettavu old schemes thappa nee antha vennupotu wit ledule jagan sir ki papam,Negative
991,"even if you do nothing, you will fall on him and cry da ke",Negative
992,"abcds do not come, jagan gave joro marks job to secretariat employees, no one is useful.",Negative
993,all that is there is to give it,Positive
994,janmabhoomi committees are the jockeys of neekharma bhoomi,Positive
995,you want a job for the cm and you have to live like this.,Positive
997,my sons like you are a waste,Negative
998,orei bolli ga don't understand what to hit you with,Neutral
999,"orey bolli babu, you can't do it, blame someone else",Negative
1000,i hate this new sachivalayams,Negative
1001,ysr party office in the villages,Positive
1002,13 members of the secretariat work in the office,Positive
1003,did you build the buildings built by the people with their money? why did you come?,Negative
1004,"how many buildings have you built, erri puka, you have built with our people's money, you have painted water tanks on all your yellow buildings.",Positive
1005,the first step to communism,Positive
1006,"who asked you to give birth land to you, should you go around your leaders",Positive
1007,chandrababu will beat the secretariat employees,Positive
1008,"swami, show me the buildings where you built them",Positive
1009,you can't give me a job for a living but you can talk,Positive
1010,bolli babu nee fights apuuuu,Negative
1011,"orei bosidiki, you are enough",Positive
1012,gram secretariat is a good concept,Positive
1013,present probation declared he is male,Negative
1014,"that fate will come to you soon, babu",Positive
1015,neeku kullu chandrababu 1 5 lacks staff ki 30 velu salary thosachivalayam employees ki jeevithannichdu nuvvu varimeeda satire vesthunnavu nuvvu emipeekavulast 15 years intikivolenteers dwara pension ippinchava musali nakka,Negative
1016,nice speaking jai tdp,Positive
1017,cabin chandranna chandranna jayamu jayamu chandranna unless swami gives jobs,Positive
1018,1 12 lakh jobs ichadra pulka you cheated that you will get a job at home,Negative
1019,cat's chin,Positive
1020,"fur, what are you looking for, milk?",Positive
1021,no money,Negative
1022,ask to make contract teachers regular sir,Positive
1023,shame on you for talking like this sir,Negative
1024,waste worst concept,Negative
1025,i have chandra babu,Positive
1026,crying brand ambassadors,Positive
1027,cbn,Positive
1028,"how many jobs did you give when you were ruling, bolli nayala",Positive
1029,"s family, you can't tolerate cabin jagan, jagan is powerful than modi g",Positive
1030,when the secretariat comes works chala fast ga jarugutunay india wide implement cheyachu,Positive
1031,40% yrs ruling em chesav yavadiki use hyderabad antav 30% chestey 100% buildup dengutaru ruling lo untey nenu kuda antho kontha develop chestanu that is not great thing oka common man yadhaga daniki nuu em chesav chepu cbn,Neutral
1032,jagan ruling is 100% better than cbn ruling,Positive
1033,secretariat in very food idea jagan,Positive
1034,it means you are a west fellow,Positive
1035,babu was talking,Positive
1036,this babu won't even get 23 seats this time,Negative
1037,ap ap ap ap ap cm jagan gaadu donga nakoduku lanjjanakoduku jagan gaadu donga 420 420 ap ap cm jagan gaadu donga nakoduku lanjjanakoduku jagan gaadu donga 420 420 ap cm jagan gaadu donga nakoduku lanjjanakoduku jagan gaadu donga nakoduku lanjjanakoduku nee amma dengganni jagan gaadu donga nakoduku lanjjanakoduku nee amma denggani jagan gaa neeku undhi,Negative
1038,"chandra babu garu, the service you provided has fallen somewhere on the employees' road, sir, please heal it a little",Positive
1039,40 years industry me life style best sir from 2 acres to 1 lakh acres,Positive
1040,sir you also want our office certificate apeetham,Positive
1041,"if the state is in debt, they are building bow buildings, sir",Positive
1042,arey koja sebum ga nv ke saav ra lucha nakodakaya,Negative
1043,burn marks,Negative
1044,"orey colors started politics, you are anna canteens, water tanks and everything, aren't you chandrababu naidu?",Positive
1045,pora yellow locust,Positive
1046,the big box is these offices,Positive
1047,tell me your opinion on the secretariat employees sir,Positive
1048,"but till now you have spoken the truth that you are the only one who is responsible for the mistakes that are happening now. shabhash chandrababu, jagan has nothing to do with the good or bad things that happen. ok, now you have admitted the truth.",Positive
1049,the biggest gongau of all,Negative
1050,hai sir tdp,Positive
1051,"whoever built it, built it with people's money",Negative
1052,these jobs are recruited for sachivalaya i couldn't understand how they can be converted to department jobs if they had declared in the beginning many unemployed persons will have written the exam are they lollipops department tests should be recruited only by announcing tests openly not indirectly many unemployed aspirants will be lollipops how are they accepting this unethical recruitment because of this their will be no stright forward jobs for another 10 years unemployed people awake before they put lollipops in your mouth,Negative
1053,don't the bus wear your party color when you are in office?,Negative
1054,"do you know how many people are benefiting from the thief babu's secretariat, how much corruption has reduced, you are a big thief.",Negative
1055,"chandrababu naidu has said in his own words how much faith he has in the voluntary system in the secretariat. chandrababu said in his own words that the volunteers of the secretariat go from house to house and rape lonely women. now he has taken a leave of absence. now if jagan wrote in andhra jyoti in his party magazine that how jagan will trouble the secretariat employees and now he gives some statement that he will do good for the secretariat employees, will people believe him? there is no one so opportunistic.",Negative
1056,"tell me my son, i will beat you",Positive
1057,sachivalayalu concept bihari prasanth kishore gadidi prati intiki veli vala party ni pracaram cesukoneki valu salaries govt kajana nunci vastundi pani ycp ki cestaruu anthe dantlo pani cese employees ki yekada ycp meetings nadicina dwakara mahilalu tesukoni ravali ledante pathakalu ravuu anii bedirincadam papam volunteers,Negative
1058,godaku kadu epudu vachina ani govt new office lo furniture workstation lu kuda ycp colors neeeeeee yendo vela colors gola govt office lo kudaàaa,Negative
1059,tdp painted yellow color for babu bujji,Positive
1060,sachivalayam jobs waste,Negative
1061,actually up batuku thindi means my people,Positive
1062,do you mean grand secretariats?,Positive
1063,"jobs need to up youth that recognize and seem sir dida that what is wrong, do you know that the contract system that you have given everyone has become nasanam sir",Negative
1064,anna meeru it meedha industries medha dhrusti pettinaru kani state lo vunna yuvata gurinchi aalochinchaleydhu pakila gurinchi aalochinchaleydhu meeru yeppudu update ga vuntaru veeti meedha kuda dhrusti petti vuntey bavundeydhi meeru oka library lantivaru politricks lo,Negative
1065,"oh bosadee, build buildings from your job, lafayette, i'm not ashamed yet.",Positive
1066,"your brother, you have not given me a single job for 40 years. i am a b.ed",Negative
1067,very intelligent political leader cbn garu,Positive
1068,neelantodi doesn't know anything except robbing,Negative
1069,it is very bad for you to say that janmabhoomi committee should be given money for every work done during your time,Negative
1070,the city of abn,Positive
1071,a major failure is the village offices,Negative
1072,"how can a good leader be known to the state? babu jagan, who came and what did he do?",Positive
1073,how many jobs did cbn give you?,Negative
1074,wali babu will make you sit at home again tomorrow,Positive
1075,yes sir your janma bhoomi committees are super than village secretariat that's why they gave you 23 chamba,Positive
1076,the poor are not human beings in your eyes,Negative
1077,farmer loan waiver is your agenda,Negative
1078,what are your plans?,Positive
1079,they have seen 11 chief ministers but they do not do such things,Neutral
1080,2 years back now why this news,Positive
1081,we are very satisfied with gws system,Positive
1082,what if 40 years,Neutral
1083,have you noticed that the movements are being suppressed by the police. the police should also think that they are protesting for you too. please don't act anarchist.,Negative
1084,tell me one good thing you did while you were there,Positive
1085,he did not give up but shed crocodile tears,Positive
1086,jai cbn tdp,Positive
1087,poraa verripuka lanjakodaka bollu kukkaa 420 gaggi kukkaa née yantaa verrupuku political broker evadunnadura vedava,Negative
1088,gone are the days of politicking,Positive
1089,secretariats are a good concept in your government people die because they can't pay bribes and can't move around the offices.,Positive
1090,didn't you paint the bathrooms yellow for tdp annacanteens? it is a strange irony that you still do not understand that the power is given by the people,Positive
1091,"you built it with your own money, dog",Positive
1092,100%correct,Positive
1093,his history started in eu,Positive
1094,"and what is the matter with janmabhoomi committees, babu?",Positive
1095,weightage of public money due to sachivalayams,Negative
1096,sachivalayam is nothing but they are ysr party office,Positive
1097,jai tdp @cbn,Positive
1098,no one has the right to hide the manifesto dastav on earth from the public.,Negative
1099,run away,Negative
1100,nuvvu job ivvavu ichevadini encourage cheyyavu colors gurinchi mataladina parvaledhu kani sachivalayam employees gurinchi matram matalu aade arhatha neeku ledhu babu endhukante vallu andharu exam rasi pass ayyaru vooriki ne job ivvaledhu vallaki,Negative
1101,"stop cabin babu said, jabu said, the reader has come to 1 lakh members, your words are comedy.",Negative
1102,"don't you know that you are a waste, sir, they sent you home",Negative
1103,this munda also speaks,Positive
1104,chandrababu ki pani ledu 40 years cm ami did,Positive
1105,pnaikimalina chandrababu mundu nuvvu kuppam lo geluvu chuddam ni koduku pappu ni mangalagiri lo gelipinchuko chalu waste candit ni caste vallani develop chesukovadam kadu rajakeeyam ante nuvvu e janmalo cm avvalevu mind it,Negative
1106,offices do not have m us,Negative
1107,"babu garu, you have no right to talk about the secretariat if you don't even think about the unemployed",Negative
1109,1 mark for cancellation of job shades sir secretariat,Negative
1110,you go home daddy little one,Positive
1111,that's why people dragged him,Negative
